### ISSUE TITLE
Android 2.3.7 handshake fails (LibreSSL 2.2.2)

### ISSUE THREAD

**Issue by Ligushka** [libressl-portable/portable#122]
nginx 1.9.3 + LibreSSL 2.2.2 fails to handshake on a server where both TLS_DHE_RSA_WITH_AES_128_CBC_SHA and TLS_RSA_WITH_3DES_EDE_CBC_SHA are negotiable. Android 2.3.7 supports SSL 3 & TLS 1.0 and sends a TLS 1.0 ClientHello so I do not believe it needs the SSL 2 handshake compatibility to function. The server immediately closes the connection after receiving a ClientHello from Android 2.3.7.
LibreSSL 2.2.1 successfully connects using TLS_DHE_RSA_WITH_AES_128_CBC_SHA on the same server and configuration.

**Comment by busterb** [comment]
Thanks, will have a look once I get a dev environment running.

**Comment by selecadm** [comment]
This is what Android 2.3 ClientHello looks like:

![image](https://cloud.githubusercontent.com/assets/10382329/9289071/d72ec38c-436b-11e5-9b31-cda43fda05dc.png)

Offset Hex

0000   16 03 01 00 4b 01 00 00 47 03 01 55 cf 3f 6c ec
0010   e2 46 a8 22 2e 2c 79 35 30 aa 88 30 c4 08 ca 50
0020   f4 47 b4 4e fa 0a c4 e4 d4 ea c8 00 00 20 00 04
0030   00 05 00 2f 00 33 00 32 00 0a 00 16 00 13 00 09
0040   00 15 00 12 00 03 00 08 00 14 00 11 00 ff 01 00

Hex stream

160301004b01000047030155cf3f6cece246a8222e2c793530aa8830c408ca50f447b44efa0ac4e4d4eac800002000040005002f00330032000a00160013000900150012000300080014001100ff0100

This is what happens:

192.168.1.60 — client
192.0.2.174 — server

19	2.424207000	192.168.1.60	192.0.2.174	TCP	66	20509→443 [SYN] Seq=0 Win=8192 Len=0 MSS=1460 WS=4 SACK_PERM=1
20	2.479463000	192.0.2.174	192.168.1.60	TCP	66	443→20509 [SYN, ACK] Seq=0 Ack=1 Win=29200 Len=0 MSS=1460 SACK_PERM=1 WS=128
21	2.479532000	192.168.1.60	192.0.2.174	TCP	54	20509→443 [ACK] Seq=1 Ack=1 Win=65700 Len=0
22	2.485094000	192.168.1.60	192.0.2.174	SSL	134	Client Hello
23	2.540193000	192.0.2.174	192.168.1.60	TCP	60	443→20509 [ACK] Seq=1 Ack=81 Win=29312 Len=0
24	2.540362000	192.0.2.174	192.168.1.60	TCP	60	443→20509 [FIN, ACK] Seq=1 Ack=81 Win=29312 Len=0
25	2.540418000	192.168.1.60	192.0.2.174	TCP	54	20509→443 [ACK] Seq=81 Ack=2 Win=65700 Len=0
28	2.570012000	192.168.1.60	192.0.2.174	TCP	54	20509→443 [FIN, ACK] Seq=81 Ack=2 Win=65700 Len=0
32	2.625032000	195.239.118.75	192.168.1.60	TCP	60	443→20509 [ACK] Seq=2 Ack=82 Win=29312 Len=0
33	2.707298000	192.168.1.60	195.239.118.75	TCP	66	20510→443 [SYN] Seq=0 Win=8192 Len=0 MSS=1460 WS=4 SACK_PERM=1
34	2.758539000	195.239.118.75	192.168.1.60	TCP	66	443→20510 [SYN, ACK] Seq=0 Ack=1 Win=29200 Len=0 MSS=1460 SACK_PERM=1 WS=128
35	2.758618000	192.168.1.60	195.239.118.75	TCP	54	20510→443 [ACK] Seq=1 Ack=1 Win=65700 Len=0
36	2.769168000	192.168.1.60	195.239.118.75	SSL	134	Client Hello
37	2.820585000	195.239.118.75	192.168.1.60	TCP	60	443→20510 [ACK] Seq=1 Ack=81 Win=29312 Len=0
38	2.820861000	195.239.118.75	192.168.1.60	TCP	60	443→20510 [FIN, ACK] Seq=1 Ack=81 Win=29312 Len=0
39	2.820898000	192.168.1.60	195.239.118.75	TCP	54	20510→443 [ACK] Seq=81 Ack=2 Win=65700 Len=0
40	2.850999000	192.168.1.60	195.239.118.75	TCP	54	20510→443 [FIN, ACK] Seq=81 Ack=2 Win=65700 Len=0
41	2.902185000	195.239.118.75	192.168.1.60	TCP	60	443→20510 [ACK] Seq=2 Ack=82 Win=29312 Len=0
50	8.397095000	192.168.1.60	195.239.118.75	TCP	54	20508→80 [RST, ACK] Seq=537 Ack=382 Win=0 Len=0

**Comment by busterb** [comment]
I was able to reproduce here as well, thanks. The faulty commit is:

https://github.com/libressl-portable/openbsd/commit/3d474f9f03c40d36629729a4e27c0b042a3e6032

**Comment by busterb** [comment]
Specifically, if there are no extensions, we should not fail with a parse error here:

https://github.com/libressl-portable/openbsd/commit/3d474f9f03c40d36629729a4e27c0b042a3e6032?diff=split#diff-2aa0f3ea280619c950a16cdd24287629L2086

**Comment by selecadm** [comment]
Yes, I noticed that Android 2 doesn't announce any TLS extensions. If only it used renegotiation_info extension instead of TLS_EMPTY_RENEGOTIATION_INFO_SCSV pseudo-cipher suite, that would be great.

**Comment by busterb** [comment]
This should be resolved as of 59785c860c90ffae3a6bea20e2d52a0ce89e4ca3 . Thanks a lot for the testing and the report.

**Comment by selecadm** [comment]
So if I want this exact behaviour (TCP FIN in case of no TLS extensions) in all future versions, there are only 2 strings I should delete from t1_lib.c. Perfect, thanks!

**Comment by yuhong** [comment]
Yea, OpenSSL/LibreSSL having to process the ClientHello twice makes bugs like this one easy to introduce. Maybe LibreSSL can look into cleaning that up later.
